objek wisata,ulasan,atraksi1,atraksi2,atraksi3,amenitas1,amenitas2,amenitas3,aksesibilitas1,aksesibilitas2,aksesibilitas3,hasil atraksi,hasil amenitas,hasil aksesibilitas
alun alun,Bagus nyaman buat liburan keluarga,,positif,positif,positif,,,,,,positif,,
alun alun,Cocok untuk rekreasi bersama keluarga,,positif,positif,positif,,,,,,positif,,
alun alun,Temptnya bagus buat liburan keluarga..,,positif,positif,positif,,,,,,positif,,
alun alun,"
Khas dari kota Lamongan , Adalah Nasi Boran ",positif,positif,positif,,,,,,,positif,,
alun alun,"Khas dg nasi boran pinggir jalan nya, dg berbagai lauk sebagai pilihan yg murah meriah pasti nya",positif,positif,positif,,,,,,,positif,,
alun alun,Alun alun lamongan...berada d tengah2 kota lamongan... Alun alun lamongan identik dengan salah satu wisata kulinernya yaitu nasi boran.... Alun alun lamongan salah satu tempat nongkrong muda mudi....alun alun,positif,positif,positif,,,,,,,positif,,
alun alun,Tempat yg bersih dan buat refreshing serta penjual nasi boran khas lamongan berjejer dgn senyum ramah menyapa... Tempat yg harus disinggahi ya bro...,positif,positif,positif,,,,,,,positif,,
alun alun,Jangan lupa kalau ke Lamongan mampir di alun alun dan makan nasi boran khas lamongan...enak rek...,positif,positif,positif,,,,,,,positif,,
alun alun,Aloon Aloon Kabupaten Lamongan adalah sebuah taman kota yang berada di pusat kota Lamongan serta banyak juga orang yang berjualan makanan khas Lamongan seperti Nasi Boran,positif,positif,positif,,,,,,,positif,,
alun alun,"saya mencoba mencicipi kuliner khas lamongan yang banyak di jual di sekitar alun2 yakni nasi boran dan es siwalan.

Rasa dari kuliner ini cukup unik dan enak layak di coba",positif,positif,positif,,,,,,,positif,,
alun alun,Nasi sego Boran sip....khas banget rasanya,positif,positif,positif,,,,,,,positif,,
alun alun,"Banyak yang jual nasi boran.. 10 ribu  dapet lauk ayam, sate jeroan, gimbal, peyek",positif,positif,positif,,,,,,,positif,,
alun alun,Kesini cari nasi boran,positif,positif,positif,,,,,,,positif,,
alun alun,"Alun-Alun kota Lamongan merupakan Alun-Alun yang berada di Lamongan dengan banyak fasilitas umum seperti tempat bermain anak-anak, taman, dan di sepanjang jalan Alun-Alun banyak pedagang kaki lima yang menjual makanan khas Lamongan seperti sego boran atau nasi boranan, tahu campur, bendeng calo, es siwalan dan banyak lainnya.",positif,positif,positif,,,,,,,positif,,
alun alun,"Tempatnya luas, sekoyar setengah hektar. Di lokasi terbagi menjadi beberapa bagian. Ada lapangan bola. Tempat bermain anak-anak, pendopo, taman dan ada pesawat terbang yg dipajang juga. Di sekitar alun alun berjejeran pedagang kali lima terdiri dari berbagai macam macam aneka makanan yg di sajikan tapi yg paling khas lamongan adalah sego boran adanya di pagi hari dan sore hari.",positif,positif,positif,,,,,,,positif,,
alun alun,"Alun-alun lamongan sedang berbenah dan dipercantik, sehingga masih terlihat kotor dan banyak bongkaran material. Disekitar area alun-alun, banyak warung nasi boran, kuliner khas lamongan. Wajib dicoba kalo sedang disini.",positif,positif,positif,,,,,,,positif,,
alun alun,tiap weekend gak pernah sepi. aneka mainan anak jg tersedia di kelilingi penjual nasi boran,positif,positif,positif,,,,,,,positif,,
alun alun,Alun-alun lamongan terletak ditengah kota Lamongan. Disini banyak sekali ragam makanan jawa timur khususnya makanan khas lamongan yaitu sego boran. Selain itu aneka permainan anak juga ada. Biasanya alun-alun ini digunakan untuk berkumpul bersama keluarga atau teman-teman.,positif,positif,positif,,,,,,,positif,,
alun alun,Tempat nongkrong kalo sore.biasanya banyak yg jual boran disini makanan khas lamongan,positif,positif,positif,,,,,,,positif,,
alun alun,Mangan nasi boran disini wenak...,positif,positif,positif,,,,,,,positif,,
alun alun,Alaun alun ini adalah titik nol kota lamongan. Di sini paling terkenal makanan nasi boran yang di jual para ibu2 di sekitaran  alun alun,positif,positif,positif,,,,,,,positif,,
alun alun,"Kalau ke alun alun kota Lamongan, yang saya ingat pasti nasi boran nya...",positif,positif,positif,,,,,,,positif,,
alun alun,persis depan alun2 lamongan bisa langsung duduk makan nasi Boran,positif,positif,positif,,,,,,,positif,,
alun alun,"Paling suka kalo ke lamongan,mampir beli nasi boran kalo ke alun alun lamongan",positif,positif,positif,,,,,,,positif,,
alun alun,"Makanan khas Lamongan ""Sego Boran"" mantaap",positif,positif,positif,,,,,,,positif,,
alun alun,Jangan lupa makan khas lamongan nasi Boran,positif,positif,positif,,,,,,,positif,,
alun alun,Tempat nongkrong dan makanan rakyat nasi boran,positif,positif,positif,,,,,,,positif,,
alun alun,Tempat kuliner khas lamongan nasi boran,positif,positif,positif,,,,,,,positif,,
alun alun,Kalau kesini yg pasti nyari sego boran,positif,positif,positif,,,,,,,positif,,
alun alun,"Melipir jalan2 disekitar alun-alun dan masjid bisa menikmati makanan khas Lamongan, ada soto, tahu campur, tahu tek, lalapan sampai bakso. Semua nya ada, just info untuk bianglala nya free cuma ada jadwalnya jadi usahakan pas jadwal ya",positif,positif,positif,,,,,,,positif,,
alun alun,"Lamongan kota soto,  sego boran.... Sangat romantis saat menjelang maghrib.....",positif,positif,positif,,,,,,,positif,,
alun alun,"Alun alun lumayan luas, ada tempat bermain untuk anak anak , banyak orang berjualan makanan tradisional, seperti petulo, es dawet, putu ayu. Soto Lamongan ,bagi kaum muslimin muslimah disebelah barat alun alun ada masjid jami'suasana sejuk dan sangat religi",positif,positif,positif,,,,,,,positif,,
alun alun,"Keren, Adiwiyata, WBL, Guyub Rukun, Lamongan Megilan, Kota Soto, Kota Boran, Tahu Campur dan masih banyak lainnya.",positif,positif,positif,,,,,,,positif,,
alun alun,Tidak afdol ketika mudik ke kampung halaman ibu kalo tidak ke alun alun kota lamongan ini. Karena kuliner khas lamaongan nasi boran dan soto lamongan cak har selalu bisa membuat rindu,positif,positif,positif,,,,,,,positif,,
alun alun,"Tempat bermain dan menghilangkan penat di tengah kota lamongan terlebih cobain makanan khas kota Lamongan yaitu soto Lamongan dan nasi boran 
cukup instrgamebel dengan pemandangan ala alun2 bangku2 taman, bunga2 dan pohon2 serta yang pasti tulisan nama kota itu.
",positif,positif,positif,,,,,,,positif,,
alun alun,"Sbg tempat yg menjadi icon kota soto, alun-alun lamongan adalah tempat yg cukup bagus. di tambah dengan nampaknya 2 menara yg menjulang tinggi menambah indahnya kota alun-alun…",positif,positif,positif,,,,,,,positif,,
alun alun,"Waktu itu saya berada di lamongan dan mampir di alun - alun ini, setelah di perbaiki banyak sekali hal menarik yang ada di alun - alun ini, hal yang tidak boleh dilewatkan adalah membeli makanan khas lamongan selain soto yaitu Sego Boran yang banyak dijajakan pedagang kaki lima yang berada di sekitar trotoar alun2",positif,positif,positif,,,,,,,positif,,
alun alun,"Tempat buat jalan"" menikmati suasana kota Soto dengan keluarga.... ada tempat bermain untuk anak anak ",positif,positif,positif,,,,,,,positif,,
alun alun,Sangat menyenangkan dg kota soto lamongan,positif,positif,positif,,,,,,,positif,,
alun alun,Soto ayam cak Wandi mak nyuss harga oke.. sebelah koperasi untuk foto buat haji,positif,positif,positif,,,,,,,positif,,
alun alun,Sarapan soto daging di pojok alun alun lamongan mantap,positif,positif,positif,,,,,,,positif,,
alun alun,"Banyak aneka kuliner disini mulai soto lamongan, lalapan, dan lain2. ",positif,positif,positif,,,,,,,positif,,
alun alun,"Soto lamongannya enak banget, rasanya khas apa lagi yg deket gapura pokoke muantep",positif,positif,positif,,,,,,,positif,,
alun alun,Indah nan mega kota soto,positif,positif,positif,,,,,,,positif,,
alun alun,"Pusat kota soto, enak sekali",positif,positif,positif,,,,,,,positif,,
alun alun,kesini cari soto lamongan yang khas dengan koyanya,positif,positif,positif,,,,,,,positif,,
alun alun,"Akses mudah ke alun-alun membuat tempat ini menjadi pusat kegiatan seni, budaya, dan pariwisata di kota tersebut",positif,,positif,,,,positif,positif,positif,positif,,positif
alun alun,Alun-alun yang letaknya di pusat kota menjadi pusat kegiatan dan kehidupan sosial bagi masyarakat,,,,,,,positif,,positif,,,positif
alun alun,Alun-alun yang terletak di tengah kota menjadi lokasi yang ideal untuk mengadakan acara atau festival besar yang dihadiri oleh banyak orang,,,,,,,positif,positif,positif,,,positif
alun alun,"Dengan lokasi yang strategis, alun-alun menjadi tempat yang mudah dijangkau oleh masyarakat yang ingin menikmati suasana kota",,,,,,,positif,positif,positif,,,positif
alun alun,Alun-alun yang letaknya strategis di tengah kota memudahkan orang-orang untuk mengunjungi tempat ini,,,,,,,positif,positif,positif,,,positif
alun alun,Alun-alun yang letaknya di pusat kota menjadi tempat kumpul dan berkumpulnya masyarakat setempat dan wisatawan.,,,,,,,,positif,positif,,,positif
alun alun,Lokasi alun-alun yang strategis di tengah kota membuat tempat ini mudah diakses oleh masyarakat lokal dan wisatawan.,,,,,,,positif,positif,positif,,,positif
goa maharani,"Suasana enak, hewan juga lumayan lengkap. ",,positif,positif,,,,,,,positif,,
goa maharani,"Tempatnya bersih, hewannya lebih banyak dan bervariasi, senang sekali kesini bersama keluarga. Bisa jadi alternatif baru untuk berlibur di kebun binatang. Goa maharani nya masih ada. Semuanya bagus lah. Cuma kurang ada foodcourt aja. Hanya ada jualan minuman dan snack lumayan laper banget keliling sini meski sekedar foto2 bercanda tawa bersama keluarga. Disini jg ada kolam renang jadi nya di dalam piramid. So, selamat liburan gess",,positif,positif,positif,negatif,negatif,,,,positif,negatif,
goa maharani,"lingkungannya kurang ramah sama kalangan disable, lansia atau orang yg kurang sehat. Maaf sblmnya ibu saya stroke jdi pergerakannya agak terbatas tapi pengen bgt tau maharani zoo, jadi ya tangga segitu banyaknya beliau ngeluh capek karena mau pake kursi roda juga gak mungkin. Mungkin suatu saat bisa ada peningkatan sarprasnya ya, biar semua kalangan bisa merasakan senengnya dan menikmati liburan di sana. Terimakasihh.. ",negatif,,,,negatif,negatif,,,,,negatif,
goa maharani,wisata edukasi kebun binatang merangkap goa maharani. sangat ramah anak dan keluarga. ada komidi putar ada renang ada berbagai binatang. tiket masuk 30-40k per orang (anak atas 85cm bayar),positif,positif,positif,,,,,,,positif,,
goa maharani," rute atau arah yang sedikit rumit meskipun sudah disediakan peta, saya agak kesusahan saat mau mengunjungi satu demi satu hewan yang ada karena pasti ada yang terlewati.",,,,,,,,negatif,negatif,,,negatif
goa maharani,"Weekend 40k / Pax jam buka 08.30, ketika memesan tiket bisa sekalian langsung membeli tiket WBL/Terusan/Goa Zoo , hewan2 lengkap, ada hiburan tentang Gajah, parkir sedikit ya, untuk motor parkirnya agak semrawut. Paling cocok kesini Bareng keluarga.

CMIIW",positif,positif,positif,negatif,negatif,negatif,,,,positif,negatif,
goa maharani,"walau cuaca panas tetap nyaman karna banyak pohonnya. Burung-burung ini paling lucu bisa dikasih makan dan jinak.
Disarankan bawa payung/pakai topi, pakai sunblock, kacamata sunglass.
Terdapat tempat makan diarea pintu masuk, harga bersahabat.",positif,positif,positif,positif,positif,positif,,,,positif,positif,
goa maharani,"Maharani zoo, baik dan mnyenangkan karna bisa feeding girafe, anak2 senang sekali,

tp sungguh sangat kecewa sm penjual oleh2..ati2 aja buat yg blnja brem d kardus wrna kuning,yg 10rb,dpt 3 kotak.. dr luar isinya d bkin kya penuh, tp isinya cm 3 biji..mnding beli yg kemasan transparan bisa kliatan isinya, smoga dpat hidayah yg produksi dan yg bkin.. dosa besar ini..",,positif,positif,negatif,negatif,negatif,,,,positif,negatif,
goa maharani,"Tempat yg cocok buat piknik edukasi ..ada hewan2 lengkap pertunjukan burung..taman bermain .toko souvenir toko oleh2 mushola & tempat duduk jg tersedia banyak .
Ada gua maharani yg indah ..",positif,positif,positif,positif,positif,positif,,,,positif,positif,
goa maharani,"Tempatnya bagus, ada bird show setiap jam 11.00 bagus untuk liburan anak anak bisa melihat langsung berbagai jenis hewan.",positif,positif,positif,,positif,,,,,positif,,
goa maharani,"Wahana edukasi buat keluarga dan anak- anak sekolah, lokasinya luas, adem banyak pepohonan, spot foto yang menarik.
Ada goa juga didalamnya, selain memberi makan hewan.",positif,positif,positif,,positif,,,,,positif,,
goa maharani,"Kesekian kalinya kesini, overall good , alternative wisata keluarga karena anak saya bilang mau lihat hewan hewan",,positif,positif,,positif,,,,,positif,,
goa maharani,"Maharani zoo and goa memberikan pengalaman baru bagi anak2, mengenai satwa. Ada harimau, kudanil, beraneka jenis burung dan lain2.

Selengjalnya ada di youtube chanel kami Jelajah family",,positif,positif,,,,,,,positif,,
goa maharani," Goa kurang menarik sepertinya jadi agak sepi,.
Singa, harimau dan jerapah kelihatan agak kurus. Kebersihan juga cukup baik, akses mudah karena langsung dipinggir jalan raya.",negatif,negatif,negatif,positif,positif,positif,positif,positif,positif,negatif,positif,positif
goa maharani,"Bismillah..yg punya anak kecil cocok ke tempat ini krn banyak binatangnya.bisa kasi makan jerapah,foto sama burung,ada bird show.bisa naik gajah tapi pas lg tutup pas kesini jd gabisa naik gajah.trs goanya masyaallah...bagus banget.musti seharian kalau ke tempat ini.toko oleh2nya jg harganya terjangkau,kaos2 25rban utk anak2.tempatnya sebrang WBL persis.jd isa dpt 2 t4 klo kesini.dan musti 2 hari yaa..biar puas mainnya.",,negatif,positif,,positif,positif,,,,,positif,
goa maharani,"Tempat wisata edukasi yg bagus buat anak2...HTM terjangkau...dekat rumah

Anak ku seneng banget bisa lihat binatang2",positif,positif,positif,,,,,,,positif,,
goa maharani,"Kebun binatang yang cukup beragam binatangnya, satu satunya kebun binatang di Lamongan, Gresik dan Tuban, lokasi yang cukup mudah di akses, dekat dengan pantai dan WBL

Harga juga cukup terjangkau hanya 35 rb per orang (promo)",positif,positif,positif,positif,positif,,positif,positif,positif,positif,positif,positif
goa maharani,"Alur dan akses untuk jalan cukup bagus, hanya harus hati-hati karena di beberapa bagian basah. Untuk menghindari kesan pengap, ada kipas dan blower besar yan tetap menjaga sirkulasi udara.",,,,positif,positif,positif,positif,positif,positif,,positif,positif
goa maharani,Deket dengan WBL (wisata bahari lamongan) mudah di akses..,,,,,,,positif,positif,positif,,,positif
goa maharani,"Dapat promo 2 free 1. Hewan relatif banyak, sebagian kurusan, tapi petugasnya baik.
Harga makanan di depan juga g malak, soto daging nya enak. Yang jual ramah. Toilet di mana2, wastafel juga
Playground boleh dipakai. Carousel juga meskipun yg naek cuma anak kita 2 orang tetep dinyalain.",,positif,positif,positif,positif,positif,,,,positif,positif,
goa maharani,Kebun binatangnya tidak terlalu besar. Hewan yang ada cukup banyak jenisnya. Cukup lengkap. Penataan bagus. Dan ada goa alam disini. Tempatnya bersih. Ada pasar oleh oleh dan tempat makannya juga yang berada diluar.,,positif,positif,positif,positif,positif,,,,positif,positif,
goa maharani,Tempatnya luas dan nyaman. Berbagai macam binatang dari berbagai daerah juga ada. Yang paling saya suka toiletnya bersih,positif,positif,positif,positif,positif,positif,,,,positif,positif,
goa maharani,"Baguuuss... banyak hewane, anak kecil bisa interaksi langsung. Bisa memberi makan hewan-hewan. Harimau juga mantabss...",positif,positif,positif,,positif,,,,,positif,,
goa maharani,goa nya kurang menarik seperti dulu,negatif,negatif,negatif,,,,,,,negatif,,
goa maharani,"Kebun binatangnya bersih, terawat.. hewan nya juga gemuk²... Bisa ngasih makan hewan juga... Khususnya jerapah... Semua karyawan ramah",,positif,positif,,positif,positif,,,,positif,positif,
goa maharani,"Tempat wisata edukasi untuk anak mengenal satwa, tarif bersahabat,koleksi binatang cukup lengkap",positif,positif,positif,,positif,,,,,positif,,
goa maharani,"Kebun binatang bersih, binatang ny y lumayan lengkap, tempat ny gak begitu luas tp lumayan buat sekedar piknik bersama kelg.",,positif,positif,positif,positif,positif,,,,positif,positif,
goa maharani,"Seru,,, tempatnya bersih.
Saran aja sih, lebih di banyakin mainan buat anak2.",,negatif,negatif,positif,positif,positif,,,,negatif,positif,
goa maharani,"Desain tempatnya bagus,
Tempat tidak terlalu panas (banyak pepohonan),
Gua nya agak lembab namun wangi (disediakan banyak kipas juga).
Rekomen untuk liburan keluarga.",positif,positif,positif,,positif,positif,,,,positif,positif,
goa maharani,"Tempat rekreasi yang menarik, keluarga pasti senang berkunjung di sana, cocok buat anak-anak karena anak-anak belajar banyak dari satwa-satwa asli Nusantara dan negara negara seperti yang ada di benua Australia, Eropa, dan Afrika.
Spot foto juga bagus. Anda dapat menikmati hiburan pertunjukan gajah dan burung disana.",positif,positif,positif,,positif,,,,,positif,,
goa maharani,"Tempatnya nyaman edukatif , toilet juga banyak , petugasnya ramah , pedagangnya juga ramah.",,,,positif,positif,positif,,,,,positif,
goa maharani,"Tiket masuk standart. Yg menyenangkan petugas nya smua ramah, fasilitas lengkap",,,,positif,positif,positif,,,,,positif,
goa maharani,"Bagus,bersih hewan terlihat sehat dan terawat.",,positif,positif,,,,,,,positif,,
goa maharani,Tempat nyaman cocok sekali utk liburan keluarga...,,positif,positif,,,,,,,positif,,
goa maharani," Lahan parkir kurang luas, kesadaran pengunjung utk kebersihan masih rendah. Tarif murah,",,,,negatif,negatif,negatif,,,,,negatif,
goa maharani,"Hewan cukup banyak, tempat bermain anak2 free tdk d pungut biaya lain",,positif,positif,,,,,,,positif,,
goa maharani,"Banyak binatang lucu, bisa bermain, pegang, naikin juga. Ada musium yg bisa menambah wawasan.",,positif,positif,,,,,,,positif,,
goa maharani,Hmm .. area terasa sunyi .. g terdengar Musik .. mungkin hewanya g suka musik kalii .. huuft jd bt ..,negatif,,negatif,,negatif,,,,,negatif,,
goa maharani,Tempat rekreasi dan edukasi satwa lumayan banyak koleksinya....,positif,positif,positif,,,,,,,positif,,
goa maharani,"Tempat cukup bagus. Bersih, hewan2 terawat dgn baik. harimaunya kelihatan gemuk dan sehat. Tiket terjangkau. Parkiran kendaraan terbatas. Bisa numpang di WBL  atau di tanah kosong sekitarnya (ongkos parkir lebih mahal, tp aman).",positif,positif,positif,negatif,negatif,negatif,,,,positif,negatif,
goa maharani,mantap buat rekreasi keluarga buat menambah wawasan anak2,,positif,positif,,,,,,,positif,,
goa maharani,"Koleksi hewan cukup lengkap. Lokasi terasa teduh meski di pinggir pantai. Ada pertunjukan hewan di jam2 tertentu. Jika pakai tiket terusan WBL, jangan lupa manage waktu agar bisa puas juga di zoo ini.",,positif,positif,,positif,,,,,positif,,
goa maharani,"Kasian sama hewannya, banyak yg kurang makan kayanya. Keliatan kurus-kurus:(",,negatif,negatif,,,,,,,negatif,,
goa maharani,Tempat wisata yang Edukasi sekali,positif,positif,positif,,,,,,,positif,,
goa maharani,"Tempatnya bagus dengan koleksi hewan yang lumayan lengkap & ada tempat bermain untuk anak², jd pasti sangat cocok buat pengetahuan anak tentang binatang",positif,positif,positif,,,,,,,positif,,
goa maharani,Harga tiket terjangkau dan wahana yang ditawarkan sangat memuaskan,positif,positif,positif,,,,,,,positif,,
goa maharani,"Kesini pas libur nasional hari senin, sehari sebelumnya WA adminnya, dan responnya ramah.. Masuk zoo aja 40rb. Didalem ada permainan anak dan ada kolam renang juga. Walopun udaranya panas, tapi rimbun dan banyak kursi untuk istirahat..",positif,positif,positif,,positif,positif,,,,positif,positif,
goa maharani,Ramai sekali after idul Fitri...menyenangkan bersama keluarga,,,,,,,,,,,,
goa maharani,"Kebersihan di tempat wisata tidak d ragukan lagi, petugas banyak dan ramah cuman sayangnya keadaan musolla yg kurang terawat apalgi d tambah pas duduk d depan petugas kebersihan nyapu d depan pintu masuk maharani zoo dan sampahnya d taruh d pojok pintu musolla sayank skali, mohon d perbaiki untuk kebersihan musolla dan tempat wudhu nya jg tidak hanya lokasi maharani nya",,,,positif,negatif,negatif,,,,,negatif,
goa maharani,Lumayan komplit hewannya,,positif,positif,,,,,,,positif,,
goa maharani,Tempat liburan yang mengedukasi anak terkait satwa yang ada di dunia.,,positif,positif,,,,,,,positif,,
goa maharani,Objek wisata di tepi jalur pantura lamongan. Koleksi hewan tidak terlalu banyak tapi hewan terawat dn lokasi zoo bersih dengan bberapa spot foto selfie,,positif,positif,positif,positif,positif,,,,positif,positif,
goa maharani,Maharani zoo yg sekaran sdh jauh lebih bagus sekali buanyak perkembangannya banyak hewan satwanya jg dn Gua Maharani jg sdh banyak perubahan lebih bagus sekali yg sekarang ini,positif,positif,positif,,,,,,,positif,,
goa maharani,"bbrp hewan disana seperti kurang terawat mgkn karena terlalu sepi, bahkan pd saat puasa kmrn tdk ada yg jual makanan di sana, hanya ada mie instant cup... Semoga kedepan bisa dibuat lebih menarik lagi sehingga semua kekurangan td bisa diperbaiki",negatif,negatif,negatif,negatif,negatif,negatif,,,,negatif,negatif,
goa maharani,"Bagus hanya saja alur perjalanan harus kemama2 dulu tu tidak jelas, terus banyak pegawai yg duduk bergelombol di setiap sesion foto satwa",,,,,negatif,negatif,negatif,negatif,negatif,,negatif,negatif
goa maharani,"saya tertipu saat beli oleh2 trnyata snack yg saya beli pas drmh dibuka dah beraroma ga enak klo orng jawa bilang ""tengik"". jd klo mau beli oleh2 mesti teliti.",,,,,negatif,negatif,,,,,negatif,
goa maharani,"Tempat liburan keluarga kalau lagi ada duit hehe. Yah udah nggak asing sih wisata ini, makin maju wahananya, nggak hanya goa, ada binatang langka juga disana. Mantep pokoknya",positif,positif,positif,,,,,,,positif,,
goa maharani,"Tempatnya nyaman banyak binatangnya juga bisa buat perkenalan buat anak"" tentang hewan harga tiketnya juga tidak terlalu mahal.",,positif,positif,,positif,positif,,,,positif,positif,
goa maharani,"Bagus banget untuk rekreasi keluarga, recommended. Koleksi binatang cukup banyak dan tempatnya bersih.",positif,positif,positif,positif,positif,positif,,,,positif,positif,
goa maharani,"Hewannya lumayan lengkap, sangat cocok jika berkunjung dengan si kecil",positif,positif,positif,,,,,,,positif,,
goa maharani,"Wisata edukasi satwa yg berhadapan dengab WBL, sangat cocok buat anak anak..",positif,positif,positif,,,,,,,positif,,
goa maharani,Tempat yang nyaman untuk anak anak..,,,,,positif,positif,,,,,positif,
goa maharani,"Banyak satwa yg menarik untuk anak2, ditambah ada kolam renang mini yg membuat anak2 lebih senang lagi.",,positif,positif,,,,,,,positif,,
goa maharani,"Wisata edukasi yg cocok untuk anak². Lg ada promo selama bulan agustus. Pengunjung yg tidak terlalu ramai dimasa pandemi seperti ini, jd aman. Tempatnya bersih dan nyaman.",positif,positif,positif,positif,positif,positif,,,,positif,positif,
goa maharani,"Edukatif untuk pengenalan hewan kepada anak sejak dini, hnya saja toilet nya kurang perawatan.",,positif,positif,negatif,negatif,negatif,,,,positif,negatif,
goa maharani,Bagus sih gua nya ... Tp kl zoo mirip2 KBS ... Tp view untk foto bnyak bnget,positif,positif,positif,,,,,,,positif,,
goa maharani,Edukasi tentang dunia Binatang dan sebuah mahakarya dari Tuhan Gua Maharani,,positif,positif,,,,,,,positif,,
goa maharani,Kebun binatangnya asik... bisa masuk ke tempat burung sayangnya kemarin pas kesana kuda poninya sedang tidak keluar..,positif,positif,positif,,,,,,,positif,,
goa maharani,Mantabb luar biasa.. menyenangkan buat anak2,,positif,positif,,,,,,,positif,,
goa maharani,Menyenangkan sekali,,positif,positif,,,,,,,positif,,
goa maharani,Nyaman.. Bersih.. Wisata edukasi yang cocok buat anak-anak dan keluarga..,positif,positif,positif,positif,positif,positif,,,,positif,positif,
goa maharani,Kebun binatang di pinggir laut daerah Lamongan hanya lokasinya agak jauh dari kota surabaya.,,,,,,,negatif,negatif,negatif,,,negatif
goa maharani,"Tempat nya jauh lebih bagus dari pada dulu, & fasilitas nya jauh lebih lengkap daripada dulu",,,,positif,positif,positif,,,,,positif,
goa maharani,"Tempatnya bagus banget.. Cocok buat anak""",positif,positif,positif,,,,,,,positif,,
goa maharani,Tempatnya nyaman dan asri.. cocok buat tujuan outbound anak usia dini,positif,positif,positif,,,,,,,positif,,
goa maharani,"Pas mau parkir area dpan lokasi penuh. Jd nya parkir d sblah lokasi.....kena dech 2x lipat dri tarif yg dpan maharani pas......Moga2 aja lahan parkir bisa d prluas. Dan misalkan wrga skitar buka parkir sndiri, karcisnya jg bisa sama2 10rb.",,,,negatif,negatif,negatif,,,,,negatif,
goa maharani,"Bagus sih banyak permainan nya, tapi yang kolam renang nya agak dangkal.",,negatif,negatif,,,,,,,negatif,,
goa maharani,Satwanya tolong digemukin...  kasihan sama yang satu ini kurus kering,,negatif,negatif,,,,,,,negatif,,
goa maharani,"Wisata goa yang cukup.indah..
Ada taman satwa juga. Cocok utk liburan keluarga dengan udara yang sejuk",positif,positif,positif,,,,,,,positif,,
goa maharani,Wisata edukasi tuk mengenalkan satwa ke si kecil,,positif,positif,,,,,,,positif,,
goa maharani,"Tiket lmyan murah dan d dalam tempat wisata lumayan bgus
Pokok y wisata lamongan luar biasa",positif,positif,positif,,,,,,,positif,,
goa maharani,sejak jaman sd sih kesini..baru ngulas aja.. bagus tempatnya. kek selalu jadi idola viewnya,positif,positif,positif,,,,,,,positif,,
goa maharani,Wisata alam nan Indah cocok untuk anak2 Bagus.... Binatangnya hampir lengkap....,positif,positif,positif,positif,,,,,,positif,,
goa maharani,Semakin indah....  Dengan tiket yang bersahabat,,positif,positif,,,,,,,positif,,
